chart_date,chart_position,chart_artist,chart_title,chart_movement,chart_peak,chart_weeks
4/5/1975,1,MUD,OH BOY,1,1,3
4/5/1975,2,MINNIE RIPERTON,LOVIN' YOU,2,2,5
4/5/1975,3,TAMMY WYNETTE,STAND BY YOUR MAN,23,3,3
4/5/1975,4,SUSAN CADOGAN,HURT SO GOOD,4,4,6
4/5/1975,5,BOBBY GOLDSBORO,HONEY {1975},3,2,7
4/5/1975,6,TAMMY JONES,LET ME TRY AGAIN,17,6,3
4/5/1975,7,FRANKIE VALLI AND THE FOUR SEASONS,THE NIGHT,16,7,4
4/5/1975,8,BAY CITY ROLLERS,BYE BYE BABY,5,1,10
4/5/1975,9,THE THREE DEGREES,TAKE GOOD CARE OF YOURSELF,9,9,5
4/5/1975,10,GILBERT BECAUD,A LITTLE LOVE AND UNDERSTANDING,12,10,7
4/5/1975,11,GLITTER BAND,THE TEARS I CRIED,8,8,5
4/5/1975,12,DISCO TEX AND THE SEX-O-LETTES,I WANNA DANCE WIT CHOO,21,12,3
4/5/1975,13,GARY GLITTER,LOVE LIKE YOU AND ME,25,13,2
4/5/1975,14,THE CARPENTERS,ONLY YESTERDAY,18,14,4
4/5/1975,15,10CC,LIFE IS A MINESTRONE,7,7,6
4/5/1975,16,PETER SHELLEY,LOVE ME LOVE MY DOG,6,3,8
4/5/1975,17,STEPHANIE DE SYKES,WE'LL FIND OUR DAY,20,17,4
4/5/1975,18,JIM GILSTRAP,SWING YOUR DADDY,11,4,9
4/5/1975,19,TEACH-IN,DING-A-DONG,13,13,5
4/5/1975,20,PETER SKELLERN,HOLD ON TO LOVE,14,14,7
4/5/1975,21,THE SWEET,FOX ON THE RUN,10,2,9
4/5/1975,22,GLADYS KNIGHT AND THE PIPS,THE WAY WE WERE,32,22,6
4/5/1975,23,DIANA ROSS,SORRY DOESN'T ALWAYS MAKE IT RIGHT,27,23,7
4/5/1975,24,KC AND THE SUNSHINE BAND,GET DOWN TONIGHT,24,21,7
4/5/1975,25,BETTY WRIGHT,WHERE IS THE LOVE,28,25,4
4/5/1975,26,SHARONETTES,PAPA OOM MOW MOW,29,26,3
4/5/1975,27,MAC AND KATIE KISSOON,DON'T DO IT BABY,46,27,2
4/5/1975,28,IAN HUNTER,ONCE BITTEN TWICE SHY,43,28,2
4/5/1975,29,WIGAN'S OVATION,SKIING IN THE SNOW,19,12,9
4/5/1975,30,SILVER CONVENTION,SAVE ME,30,30,6
4/5/1975,31,WEST HAM UNITED CUP SQUAD,I'M FOREVER BLOWING BUBBLES,New,31,1
4/5/1975,32,LABELLE,LADY MARMALADE,26,17,8
4/5/1975,33,JACKIE WILSON,I GET THE SWEETEST FEELING {1975},44,33,2
4/5/1975,34,GOODIES,THE FUNKY GIBBON/SICK MAN BLUES,15,4,9
4/5/1975,35,WOMBLES,WOMBLING WHITE TIE AND TAILS,New,35,1
4/5/1975,36,THE STYLISTICS,SING BABY SING,New,36,1
4/5/1975,37,JOHN LENNON,STAND BY ME,48,37,2
4/5/1975,38,KRAFTWERK,AUTOBAHN,New,38,1
4/5/1975,39,SYLVIA,HASTA LA VISTA,38,38,3
4/5/1975,40,DESMOND DEKKER,THE ISRAELITES,New,40,1
4/5/1975,41,THE AVERAGE WHITE BAND,CUT THE CAKE,31,31,3
4/5/1975,42,TAMI LYNN,I'M GONNA RUN AWAY FROM YOU {1975},50,42,2
4/5/1975,43,MIKE REID,THE UGLY DUCKLING,22,10,8
4/5/1975,44,ERIC CLAPTON,SWING LOW SWEET CHARIOT,New,44,1
4/5/1975,45,PILOT,CALL ME ROUND,34,34,4
4/5/1975,46,TONY REES AND THE COTTAGERS,VIVA EL FULHAM,New,46,1
4/5/1975,47,MOMENTS AND WHATNAUTS,GIRLS,35,3,10
4/5/1975,48,LULU,TAKE YOUR MAMMA FOR A RIDE,37,37,4
4/5/1975,49,GUYS AND DOLLS,THERE'S A WHOLE LOT OF LOVING,33,2,11
4/5/1975,50,FOX,"IMAGINE ME, IMAGINE YOU",New,50,1
